date|title|link
Oct-02|Friday delivered the selling the prior weeks close suggested would occur|https://www.markets.fallondpicks.com/2022/10/friday-delivered-selling-prior-weeks.html
Sep-30|Creativity in Finding Market Opportunity|http://traderfeed.blogspot.com/2022/09/creativity-in-finding-market-opportunity.html
Sep-29|Yesterday's relief bounce negated in one day|https://www.markets.fallondpicks.com/2022/09/yesterdays-relief-bounce-negated-in-one.html
Sep-27|No bounce, markets set for more losses|https://www.markets.fallondpicks.com/2022/09/no-bounce-markets-set-for-more-losses.html
Sep-27|Very Oversold Stock Market:  Is It Time To Buy?|http://traderfeed.blogspot.com/2022/09/very-oversold-stock-market-is-it-time.html
Sep-26|How Far Could Stocks Fall?|https://dailyreckoning.com/how-far-could-stocks-fall/
Sep-25|Look for a bounce Monday, but don't expect it to last|https://www.markets.fallondpicks.com/2022/09/look-for-bounce-monday-but-dont-expect.html
Sep-24|The World of 2030|https://dailyreckoning.com/the-world-of-2030/
Sep-23|How Much Money Is Inflation Costing You?|https://dailyreckoning.com/how-much-money-is-inflation-costing-you/
Sep-22|Are Stocks Cheap Again?|https://dailyreckoning.com/are-stocks-cheap-again-2/
Sep-21|Bulls fail for a second time - but outcome is more damaging|https://www.markets.fallondpicks.com/2022/09/bulls-fail-for-second-time-but-outcome.html
Sep-21|Powell Does It Again|https://dailyreckoning.com/powell-does-it-again/
Sep-20|Deep Into the Danger Zone|https://dailyreckoning.com/deep-into-the-danger-zone/
Sep-20|Peak Connected and Hello From Tel Aviv|https://howardlindzon.com/peak-connected-and-hello-from-tel-aviv/
Sep-19|Bullish Engulfing Patterns - But Volume Light|https://www.markets.fallondpicks.com/2022/09/bullish-engulfing-patterns-but-volume.html
Sep-19|Another Crack in the Dollar’s Foundation|https://dailyreckoning.com/another-crack-in-the-dollars-foundation/
Sep-19|Momentum Monday…What Will Apple Do and What Are The Best Venture Capitalists Excited About|https://howardlindzon.com/momentum-monday-what-will-apple-do-and-what-are-the-best-venture-capitalists-excited-about/
Sep-18|Bulls last chance to bounce the decline|https://www.markets.fallondpicks.com/2022/09/bulls-last-chance-to-bounce-decline.html
Sep-18|Four Reasons You May Not Be Succeeding In Your Trading|http://traderfeed.blogspot.com/2022/09/four-reasons-you-may-not-be-succeeding.html
Sep-18|My 57th Birthday Climbing Stelvio …|https://howardlindzon.com/my-57th-birthday-climbing-stelvio/
Sep-17|Here’s Who Loves Inflation|https://dailyreckoning.com/heres-who-loves-inflation/
Sep-16|The Great Pillaging|https://dailyreckoning.com/the-great-pillaging/
Sep-16|I LOVE The Alps|https://howardlindzon.com/i-love-the-alps/
Sep-15|Best of Panic With Friends: Ted Merz – Journalist Turned Product Manager, Former Global Head of News at Bloomberg on Financial Journalism and Information Dissemination in the Age of Social Media|https://howardlindzon.com/best-of-panic-with-friends-ted-merz-journalist-turned-product-manager-former-global-head-of-news-at-bloomberg-on-financial-journalism-and-information-dissemination-in-the-age-of-social-med/
Sep-14|Sellers wipe four days of gains in one go on higher volume distribution|https://www.markets.fallondpicks.com/2022/09/sellers-wipe-four-days-of-gains-in-one.html
Sep-14|Goodbye For Now Lake Como…I Will Be Back|https://howardlindzon.com/goodbye-for-now-lake-como-i-will-be-back/
Sep-13|Momentum Monday…People Are Too Optimistic About Growth and Technology|https://howardlindzon.com/momentum-monday-people-are-too-optimistic-about-growth-and-technology/
Sep-12|Four straight days of gains on falling volume|https://www.markets.fallondpicks.com/2022/09/four-straight-days-of-gains-on-falling.html
Sep-12|Should USA Ban Tik Tok?|https://howardlindzon.com/should-usa-ban-tik-tok/
Sep-11|Trading Lesson From a Social Psychology Experiment|http://traderfeed.blogspot.com/2022/09/trading-lesson-from-social-psychology.html
Sep-11|Sunday Reads and Watches and Listens…Apple, NFT’s, Nolan Ryan and Incrementalism|https://howardlindzon.com/sunday-reads-and-watches-and-listens-apple-nfts-and-nolan-ryan/
Sep-10|Como Como Como|https://howardlindzon.com/como-como-como/
Sep-04|We Become What We Do|http://traderfeed.blogspot.com/2022/09/we-become-what-we-do.html
Aug-28|Four Pieces of Trading Wisdom to Turn Your Trading Psychology Around|http://traderfeed.blogspot.com/2022/08/four-pieces-of-trading-wisdom-to-turn.html
Aug-18|Improving Your Trading Psychology By Improving Your Trading|http://traderfeed.blogspot.com/2022/08/improving-your-trading-psychology-by.html
Aug-05|The Key to Understanding and Overcoming Trading Tilt|http://traderfeed.blogspot.com/2022/08/the-key-to-understanding-and-overcoming.html
May-21|New Issue Now Available: What Hedge Funds Bought/Sold in Q1 Volatility|http://www.marketfolly.com/2022/05/new-issue-now-available-what-hedge.html
